ID,Title,Location,Salary,Summary
https://kr.indeed.com/viewjobs?jk=67439dfbda3ad52a,[Janssen] Data Management Specialist,Johnson & Johnson Family of Companies 4.2 서울,,health issues. 1. 포지션: Data Management... JIMS)” systems data in accordance... wholesaler’s data processing policies...
https://kr.indeed.com/viewjobs?jk=8ead35848215751c,Associate data research analyst,Morningstar 서울,,Data expert on investment data points... design data collection plans & bring back the voice... client. Data expert...
https://kr.indeed.com/viewjobs?jk=e862b352b77c9b04,"[EY컨설팅] 컨설팅본부 DnA 팀 Data Engineer, Backe...",Ernst & Young 4.0 대한민국,,"서비스를 제공하고 있습니다. [EY컨설팅] 컨설팅본부 DnA 팀 Data Engineer, Backend 개발자 신입/경력 컨설턴트 모집 * 모집... 전산, 산업공학, 수학, 통계 또는 Data Science 관련 전공자..."
https://kr.indeed.com/viewjobs?jk=cd8c33fcd9067405,2021 롯데그룹 부문별 신입/경력,롯데그룹 대한민국,,인크루트 - 템플릿 6 롯데그룹 2021 롯데그룹 부문별 신입/경력 채용공고 롯데글로벌로지스 채용 공고 연결 URL 2021 롯데글로벌로지스 정보전략 경력사원 채용 자세히 보기 2021 롯데글로벌로지스 인프라(전기) 경력사원...
https://kr.indeed.com/viewjobs?jk=81e402f259d6f4ef,락앤락 각 부문별 경력사원,락앤락 3.0 서울 서초구,,"감사 업무 관련 내외보고 및 개선이행 관리) - 내부통제 방안 수립( Data 기반의 내부통제, 조직 내 Risk 분석 및 평가 등) - 내부 프로세스... 스템 경험자 - OA문서 작성 및 DATA 가공 능력 보유자 - 영어 능통..."
https://kr.indeed.com/viewjobs?jk=9bb81933b6479c86,[Janssen] Business Data Analyst,Johnson & Johnson Family of Companies 4.2 서울,,1. 포지션: Business Data Analyst 2. 계열사: 한국... through synthesizing data and information from different kinds of data sources...
https://kr.indeed.com/viewjobs?jk=37f6f267e52eb4bb,Brand Management Internship,Procter & Gamble 4.2 서울,,"G invented the concept of branding and data-driven brand management? Over the years... insights from the data, which will enable..."
https://kr.indeed.com/viewjobs?jk=f3fd83b6536f8c12,No.1 금융투자플랫폼 관련 Digital/IT 직군 경력직,KB증권 대한민국,,"[KB증권] No.1 금융투자플랫폼 관련 Digital/IT 직군 경력직 채용 Mission : KB증권의 “No.1 금융투자플랫폼(고객중심의, 지속적으로 이용하고자 하는)” 사업자 지향 모집부문(※세부내용 첨부된 링크..."
https://kr.indeed.com/viewjobs?jk=c14b6d6c1bc5a2d3,Stock Clerk,ASO 대한민국,,"container, and applying labels or entering identifying data on container. Responsibilities: Inventory parts in storage..."
https://kr.indeed.com/viewjobs?jk=e1ebfac18d00b273,[SK바이오사이언스] 21년 1분기 수시,에스케이바이오사이언스 성남 분당구,,"PPT 등) 활용 능력 - 우 대 1) SAP SD 모듈 활용 가능자 2) Python, R 등 다양한 data분석 tool 활용 가능자 마케팅PM - 직 무 1) 시장 분석 및 projection 2) MKT 전략 및..."
https://kr.indeed.com/viewjobs?jk=b548e7fd9e95f0aa,[AIRS] Data Scientist,현대자동차그룹 4.4 서울,,모집분야 부문 분야 직위 근무지 S/W S/W 연구원 / 책임연구원 서울 강남
https://kr.indeed.com/viewjobs?jk=e8a4630bec0783e8,2021 Market Data Analyst - Seoul,Bloomberg 서울,,"Bloomberg runs on data, and data drives the market. Our Global Data team acquires... data set Utilise statistics and data..."
https://kr.indeed.com/viewjobs?jk=52ae92071351d501,2021년도 제2차 정규직 직원,한국식품연구원 전라북도 완주,,전자·기계·기술·화학·연구개발>바이오·식품공학>식품|인터넷·IT·통신·모바일·게임>ERP·시스템분석·설계>데이터분석|건설·건축·토목·환경>시설·환경·안전·플랜트>산업안전|건설·건축·토목·환경>시설·환경·안전·플랜트>안전관리...
https://kr.indeed.com/viewjobs?jk=6e96d60891591a1e,"2021년 경력직원 공개 (건축, 전기, 플랜트, 국내영업, 전산기획)",쌍용건설 4.0 서울 송파구,,쌍용건설 경력직원 공개채용 회사소개 모집부문 및 자격요건 구 분 모집 직무 자격요건 및 우대사항 고용 형태 건축 시공 - 건축 시공 경력 3년이상 정규직 공무 - 건축 공무 경력 3년이상 조경 - 조경설계 및 조경시공관리...
https://kr.indeed.com/viewjobs?jk=dfb20fa220f3c478,"빅데이터, 인공지능(AI) 외 신입/경력 인턴",스칼라웍스 대한민국,,"(주)스칼라웍스 빅데이터, 인공지능(AI) 외 신입/경력 인턴 채용 모집부문 및 자격요건 담당업무 자격요건 인원 데이터 수집 및 가공 R, SQL 등을 활용한 데이터 분석 [자격요건] 경력사항: 신입, 경력(연차무관) 학력사항..."
https://kr.indeed.com/viewjobs?jk=0e7191f794dc7cf5,[EY컨설팅] 컨설팅본부 GPS 팀 인턴 모집,Ernst & Young 4.0 대한민국,,". EY는 전 세계 153개 국가에 걸쳐 284,000명의 회계감사, 세무, 재무자문, 어드바이저리 서비스 전문가들이 활동하고 있는 회계,컨설팅 분야의 글로벌 리더입니다. EY한영은 EY 글로벌 조직의 한국 회원법인으로서 약..."
https://kr.indeed.com/viewjobs?jk=44e296c35565070b,2021년 상반기 신입/경력사원,청담러닝 서울 강남구,,"디자인 패턴 이해 비디오 콘텐츠, 음성 녹화, 오디오 제어 개발 경력 3년 이상 DBMS DBMS 운영 및 관리 Data Backup/Restore/Migration DB 모니터링 및 장애 대응 Query 검수 및 성능 튜닝..."
https://kr.indeed.com/viewjobs?jk=18f62dc644a89e0c,2021 Global Data Internship - Seoul (Kor...,Bloomberg 서울,,"Bloomberg runs on data, and data drives the market. Our Global Data team acquires and supplies this data to our clients..."
https://kr.indeed.com/viewjobs?jk=f8b198c1862e0909,Dream Internship (Rolling Basis),Procter & Gamble 4.2 서울,,experiences. Has analytical ability to derive insights from data and come up with business or organizational decisions. Shows...
https://kr.indeed.com/viewjobs?jk=7a37f5e7658eb15d,[기술연구소] 딥러닝 연구 담당자,한국카카오은행 성남 분당구,,[기술연구소] 딥러닝 연구 담당자 담당할 업무 [기술연구소]· 영상처리 관련 기술 개발· 자연어 처리 관련 기술 개발 · 상용화를 고려한 선행연구 필수 경험과 역량 · 영상과 자연어처리 기술을 이용한 상용화 서비스 경험이 있는...
https://kr.indeed.com/viewjobs?jk=92fecb92c72334bd,컨설팅 / 모의해킹 신입 및 경력직 컨설턴트,SK인포섹 2.9 대한민국,,"서비스 분야 1위 기업으로, 사이버 보안 분야에서 국내 최고의 기술력을 자랑하고 있습니다. 앞으로 Cloud, Data, IoT 등 New ICT 분야로까지 확장된 영역에서 보안을 책임지는 중요한 역할을 맡을 수 있는 인재를..."
https://kr.indeed.com/viewjobs?jk=9acc17c535b42959,2021년 (신입) 전문연구요원 모집,NHN 4.4 성남 판교역,,"NHN과 함께 세계로 도약할 패기와 역량을 갖춘 인재를 찾습니다! 열정을 가진 분들의 많은 지원 바랍니다. * 본 채용은 상시 채용으로 면접이 수시로 진행되며, 先지원자에게 기회가 먼저 부여되므로 빠른 지원 바랍니다..."
https://kr.indeed.com/viewjobs?jk=4ec27c619c3887e4,서울특별시 지방공무원 제1회 경력경쟁,서울특별시 5.0 대한민국,,"선발분야 : 민생사법수사(행정7급) 3명, 데이터전문(전산7급) 2명, 도시공간기획(건축7급) 1명, 교통신호운영(전기7급) 1명, 감염병 관리(보건7급) 3명, 감염병 조사분석(보건연구사) 4명, 기록보존관리(공업연구사..."
https://kr.indeed.com/viewjobs?jk=fff0bad3ab08265e,Data Center Logistics Specialist,Amzn Corporate Services Korea 서울,,"related to our Data Center Operations... You... responsible for gathering data, generating, publishing and presenting..."
https://kr.indeed.com/viewjobs?jk=3bd0ebd98b8540fa,OTC&Healthcare사업실 마케터 모집,한독약품 서울,,"competitors through fine analysis of pharmacy and consumer data, and deliver into developing optimal strategies/ tactics..."
https://kr.indeed.com/viewjobs?jk=4bd70fb8a220d90d,[Janssen] Data Scientist,Johnson & Johnson Family of Companies 4.2 서울,,teams to improve data mining processes... data sources. [Requirements] 1. 3+ years of experience in a business-related data...
https://kr.indeed.com/viewjobs?jk=effe1568ddcb50a3,"국내캐피탈사 데이터분석,.",제이엔커리어 서울 강남구,,통계/ Data 분석 경력자 (1년이상) * 우대사항 - 온라인 마케팅 제휴 관련 경력자 - Retail 신용대출 부분 통계/ Data 분석 경력자... Retail 신용대출 부분 통계/ Data 분석 경력자 - 통계 연관 전공자...
https://kr.indeed.com/viewjobs?jk=a236858732740e0a,Public Relation Intern,Amazon Web Services Korea LLC 서울,,report · Maintain media relations · Market research or data research · Provide logistics support for PR project or event...
https://kr.indeed.com/viewjobs?jk=ee2cad5a4861601b,[이마트24] [Data Scientist] 경력사원 모집(Senior),신세계 4.5 대한민국,,선도할 Data 전문가를 모십니다. 1. 대상직무 : Data 분석 및 활용( Data Scientist) - 문제정의 문제 해결에 필요한 Data 정의 및 확보 - 통계적 Data 분석 및 Data Analytics...
https://kr.indeed.com/viewjobs?jk=4df1f3127061b74d,Data-Driven 광고운영/데이터분석,데이타스텔라 서울 강남구,"연봉 40,000,000원 - 50,000,000원",주식회사 데이타스텔라 Data-Driven 광고운영/데이터분석 모집부문 및 자격요건 담당업무 자격요건 인원 [담당업무] 데이터 스텔라는 오디언스데이타 기반의 마케팅을 위한 전반적인 컨설팅/광고집행/분석업무를 지원하는 회사로...
https://kr.indeed.com/viewjobs?jk=679aa0d1ec599088,Online marketing Assistant // 외국계 화장품 회사...,크레돈 서울 강남구,,supplies and VM productions -. Report weekly sell-through data -. Monitor competitor activities offline/online -. SMC counter...
https://kr.indeed.com/viewjobs?jk=7b1ee6e00873ddb9,2021년 상반기 정규직 경력(사무직·보건직),국민건강보험 일산병원 고양 일산동구,,"정규 경력 6급 1. 모집인원 및 응시자격 - 모집분야 및 인원 : 5개 분야, 총 5명 ① 사무직-데이터분석(의료정보팀), 1명 ② 사무직-기계설비(시설팀), 1명 ③ 보건직-방사선사(영상의학과), 1명 ④ 보건직..."
https://kr.indeed.com/viewjobs?jk=82e0a7b39a38a0e8,제휴기획(일본) 경력사원,LG유플러스 3.8 서울특별시,,"직무상세 - 제휴기획 (일본ICT업체 벤치마킹, 신규 Biz. 분석 및 제휴 추진) 수행 업무(R&R) - C-Level/부문장 Meeting 시 원활한 통번역 업무 지원 - 일본 ICT업체 벤치마킹 및 일본 ICT업계 고문..."
https://kr.indeed.com/viewjobs?jk=80f768a4835140f8,2021년도 제정규직 직원,한국식품연구원 전라북도,,"채용분야 환경.에너지.안전,연구 고용형태 정규직 대체인력여부 아니오 학력정보 학력무관,석사 채용구분 신입+경력 근무지 전북 채용인원 4 우대조건 국가보훈대상자, 장애인, 여성과학기술인, 지역인재 증빙서 제출 시 우대, 식품..."
https://kr.indeed.com/viewjobs?jk=b4a1174a3d8ada97,[감사] IT감사역,한국카카오은행 성남 분당구,,"담당할 업무 [감사운영]· 인터넷전문은행을 위한 효율적이고 효과적인 IT감사체계 수립 및 운영· IT감사목표 및 전략모색, IT감사계획 수립 및 감사활동 수행 · 금융당국의 IT부문실태평가, 테마검사 등 각종 검사시 수검..."
https://kr.indeed.com/viewjobs?jk=55584c627df1acaa,데이터 분석가/사이언티스트(신입/인턴 가능),쏘카 대한민국,,"에서 근무하는 방식, 업무 관련 이야기 : https://tech.socarcorp.kr/ data/2020/08/19/socar- data-group-intern-review.html 주요업무 • 핵심 비즈니스를 파악하고 개선..."
https://kr.indeed.com/viewjobs?jk=313cd714872ab43c,"[데이터 분석팀] Data 분석 기획 , AI 인공지능 신입 & 경력자",이브이패스 제주 제주시,,인터넷·IT·통신·모바일·게임>빅데이터·AI(인공지능)>빅데이터|인터넷·IT·통신·모바일·게임>ERP·시스템분석·설계>인공지능(AI) 분석
https://kr.indeed.com/viewjobs?jk=9d1832648fe5a88d,Data Center Regional Mechanical Engineer...,Amzn Corporate Services Korea 서울,,review for new Data Centers in your... aspects... data centers. You will prioritize your activities to support data...
https://kr.indeed.com/viewjobs?jk=b3891b8c405f34e6,Data Analytics 컨설턴트 - 글로벌 컨설팅Firm,에스에프인촌 서울,,Data Analytics 컨설턴트 채용 - 글로벌 컨설팅Firm 모집부문 및 자격요건 담당업무 자격요건 인원 1. 채용 회사 : 글로벌 컨설팅 Firm 2. 채용포지션 : 신기술부문 컨설턴트 3. 담당 직무 : Data...
https://kr.indeed.com/viewjobs?jk=adba044d74c8b7cc,[2021?????] Data Analyst,Hyperconnect 서울,,Product Data Analyst Data Analyst Hiring Team . Business Data Analyst Business Data... recommend Match Data Analystnbsp; Apply...
https://kr.indeed.com/viewjobs?jk=44a4245679066940,Data Science 컨설턴트 - 글로벌 컨설팅펌,에스에프인촌 서울 서초구,,"Position AI, Data Analytics 등 신기술부문 경력직 모집 담당업무 AI, Data Analytics 등 신기술 관련 Specialist로서 기업들의 다양한 Business 이슈에 대해 정형/비정형 데이터..."
https://kr.indeed.com/viewjobs?jk=97098b6ecc8afba1,Public Affairs Specialist,US Department of the Army 4.3 대한민국,,"special interest groups and individuals. Gathers and analyzes data and information to prepare reports budgets, resource plans..."
https://kr.indeed.com/viewjobs?jk=be726798ecabfac5,[SK바이오사이언스] 21년 1분기 임상허가 신입/경력,에스케이바이오사이언스 성남 분당구,,Data Management - 직 무 1) Clinical Data Management 업무 set-up 2) Clinical Data... 혹은 통계 관련 학과 - 경 력 : Data Management 업무 경력...
https://kr.indeed.com/viewjobs?jk=e9ac1a8708b8e784,[상시 ] Data Scientist (대리급/과-차장급/정규직),라이나생명보험 서울 종로구,,모집분야 구분 주요업무 지원자격 Data Scientist ﻿(대리급... 우대 보험/금융업 데이터 분석 업무 경험자 우대 구분 주요업무 지원자격 Data Scientist Specialist (과-차장급) 현업 문제에 다양...
https://kr.indeed.com/viewjobs?jk=76e2be23d5eb0bc3,Data Services Intern - Korea,Willis Towers Watson 서울,,"The Business Global Data Service at Willis... benefits data, conduct checks and validation as well as support data analysis..."
https://kr.indeed.com/viewjobs?jk=c54efba262d86ecc,[EY컨설팅] 컨설팅본부 Data & Analytics팀 경력 컨설턴트...,Ernst & Young 4.0 대한민국,,"있습니다. [EY컨설팅] 컨설팅본부 Data & Analytics팀 경력... 술서,자기소개서) [다운로드] - 첨부 파일명과 메일 제목은 반드시 [ Data & Analytics _경력직_성명] 으로 기입바랍니다. *위 사항..."
https://kr.indeed.com/viewjobs?jk=3d716b9d0c288408,2021년 연구직(부연구위원급 이상) 공개채용 공고,국토연구원 대한민국,,내용보기 2021년 연구직(부연구위원급 이상) 공개채용 2021년 연구직(부연구위원급 이상) 공개채용 공고 국토연구원은 국토의 이용·개발·보전에 관한 정책을 종합적으로 연구하는 정부출연연구기관으로 국토의 미래를 선도할...
https://kr.indeed.com/viewjobs?jk=50a4d23577c58924,2021년 2분기 에이비엘생명보험 신입/경력/인턴 직원,ABL생명보험 서울 영등포구,,모집 부분 2021년 2분기 에이비엘생명보험㈜ 신입/경력/인턴 직원 채용 서류 접수 기간 2021년 3월 8일(월) 09시부터 ~ 3월 28일(일) 밤 12시까지 지원 방법 에이비엘생명보험㈜ 채용 홈페이지에서 온라인 지원...
https://kr.indeed.com/viewjobs?jk=790d6275c9dd7be8,Data Scientist 모집,한독약품 서울,,"기여한다. 1. Data Analysis 내부(Internal Sales, MR Activity data), 외부(In-Market Secondary data) Data 통합, 검증, 분석최적화 패턴/추세 분석 등 다양..."
https://kr.indeed.com/viewjobs?jk=18abce2eab7b971e,"Business Intern, Veteran",Google 4.3 서울,,"information for millions of internet users, analyzing large sets of data, or developing scalable support solutions for rapid..."
https://kr.indeed.com/viewjobs?jk=f4ef1263e43f9fab,직원 [교육홍보/ 연구보조원],한국바이오의약품협회 서울 서초구,,한국바이오의약품협회 공고 제2021-1호 한국바이오의약품협회 채용 공고 『한국바이오의약품협회』는 바이오의약품 산업 발전과 국민의 건강증진에 이바지하기 위하여 식품의약품안전처 산하에 설립된 단체입니다. 바이오헬스 산업 발전과...
https://kr.indeed.com/viewjobs?jk=0e8cdd9b3192beed,"Field Applications Scientist, Korea",Illumina 서울,,used sequencing data analysis software... next generation sequencing or array data is a huge plus Illumina believes...
https://kr.indeed.com/viewjobs?jk=c8ae7d6d6c990e8e,"Government & Public Affairs Director, So...",Nike 4.1 서울,,"enforcement on online platforms to practical laws enabling use of data for connected memberships, personalization, consumer..."
https://kr.indeed.com/viewjobs?jk=b7bfb4872512b6e4,Safety Data Sheet Author / Regulatory Af...,knoell Germany GmbH 서울,,seeking a Safety Data Sheet Author... ecotoxicological data You are responsible... preparation of safety data sheets...
https://kr.indeed.com/viewjobs?jk=1b8e874a13522f26,Market Research team Intern,IQVIA 서울,,"leading human data science company... harness the power of healthcare data, domain expertise, transformative technology..."
https://kr.indeed.com/viewjobs?jk=4f5e8930744f4823,[구미]1차 협력사 PCB검사업체 생산OP 및 검사 교대 사원 ( 근무지...,인재솔루션 경상북도,"시급 8,720원",사만 좌식 근무) ㆍFVI (현미경 검사 공정) ㆍVRS (모니터형 검사 공정) ㆍQC (품질 검사 공정) ㆍ DATA (데이터 관리 공정) ㆍRINSE (이물질 제거 하는공정) ㆍ포장 (진공 포장 공정) 삼화 물류 - 남성분...
https://kr.indeed.com/viewjobs?jk=34f896f776c93cb1,[틱톡] 하반기 각 부문별,바이트댄스 서울 중구,,"from data, and use that data to make... data tracking and monitoring system, analyze and interpret sales business data..."
https://kr.indeed.com/viewjobs?jk=f11753f189adc947,Research Coordinator,Guerbet 서울,,resources and provide the latest emerging data in response to specific healthcare... reporting data in connection with safety...
https://kr.indeed.com/viewjobs?jk=54ed91089ebd24b6,(주)창성텍 2021년 상반기 경영지원부 인사/전산총무 (아날로그자료 데...,창성텍 경기도 화성,,"[지원자격] ㆍ서버관리 또는 데이터 관리 가능자 [우대사항] ㆍ해당직무 인턴경력, 해당직무 알바경험, 해당직무 근무경험 ㆍ컴퓨터활용능력 우수, 엑셀 고급능력자, 문서작성 우수자 [홈페이지] http://changsungtec..."
https://kr.indeed.com/viewjobs?jk=951fbb127e3f7e08,[중장비업체]전산총괄(차장-부장급),비에이블컨설팅그룹 경기도 부천,,[포지션명] 전산총괄(차장-부장급) [담당업무] - 정보시스템 기획 및 운영 총괄 - 정보시스템 기획 및 관리 - 정보시스템 구축 프로젝트 수행 [지원자격] - 4년제 대학 졸업자 - 정보시스템 구축 및 운영 경력 : 13년...
https://kr.indeed.com/viewjobs?jk=35191630a109eec2,서울특별시데이터센터 공무직,서울특별시 5.0 대한민국,,서울특별시 데이터센터 공고 제2016-7호 서울특별시 데이터센터 공무직 채용시험 공고 서울특별시데이터센터에서 근무할 공무직 직원을 다음과 같이 공개 모집 합니다. 2016년 4월 22일 서울특별시데이터센터소장 1...
https://kr.indeed.com/viewjobs?jk=917cc06120add6e1,Data Scientist,Soomgo 서울 강남구,,"서류전형: 이력서(자기소개서) & 경력기술서 • 직무기술(역량): 사전 과제 진행 • 인터뷰: CPO & Data Scientist • 최종합격: 처우협의 및 R&R 정의 • Finally, 숨고 멤버로 Join!"
https://kr.indeed.com/viewjobs?jk=044e3711a30db6c1,AP Accountant,Bruker 경기도 성남,,account analysis Maintain SAP invoice and local VAT invoice data and ensure local tax statutory regulation Perform employee...
https://kr.indeed.com/viewjobs?jk=30d390b6c06d132f,[대학혁신지원사업] 교수학습개발원-교육혁신데이터센터 계약행정직 채용 공고,카톨릭 대학교 4.0 대한민국,,"교수학습개발원과 교육혁신데이터센터에서는 업무능력이 뛰어나며, 성실하고 인간관계가 원만한 인재를 아래와 같이 모집합니다. 1. 채용부문 및 지원자격 (1) 기본사항 채용부서 담당업무 자격 요건(필수)(으)로 구성한..."
https://kr.indeed.com/viewjobs?jk=9a818d9d91db847d,Data Analytics SA,Amazon Web Services Korea LLC 서울,,"applications, Data Lakes, Data Migration... Analytics, Big Data or Data Warehousing specialist? Do you have experience of data..."
https://kr.indeed.com/viewjobs?jk=6017310f2b5808b8,Graphic Asset Representation Clerk - Cam...,ASO 대한민국,,vehicle location data... US Army and compiles the data... Graphic Asset... data systems and automated data system...
https://kr.indeed.com/viewjobs?jk=79e93ed03e531b5f,2021년 상반기 각 부문 신입 및 경력사원,내집처럼 서울 금천구,,(주)내집처럼 2021년 상반기 각 부문 신입 및 경력사원 채용 모집부문 및 자격요건 모집분야 담당업무 자격요건 제출서류 모집인원 인테리어 디자인 설계/시공/공무 인테리어 설계 / 시공 / 공무 [자격요건] 학력무관 / 경력...
https://kr.indeed.com/viewjobs?jk=b95d00f1145e5ef3,(광주취업맛집1위)2021년도 국비 기술교육생,대한상공회의소 광주인력개발원 광주 광산구,,당신의 꿈과 미래를 밝혀 줄 광주인력개발원 2021년도 국비 기술교육생 모집 회사소개 모집과정 구분 과정명 교육기간 접수마감 개강 바로가기 4차산업 IoT/AI기반응용SW개발자* 10개월 2월 15일 2월 16일 AI플랫폼활...
https://kr.indeed.com/viewjobs?jk=292f7eacd69f6e05,Data Platform 기획자,PUBG 서울,,[모집 분야] Data Platform 기획자 크래프톤 출시되는 게임들에... 담당 업무] - 자가 데이터 분석 플랫폼(Self-Serviced Data Analytics Platform) 구축 기획 - 데이터 수집 & 전처리...
https://kr.indeed.com/viewjobs?jk=83665cf1e6af7ae8,환경안전분야 경력사원 (청주/오창공장),LG화학 청주 오창읍,,직무상세 - 사내외 협력업체 안전관리 및 법규 준수사항 점검/협의회 운영 - 사고조사 및 Big- data 분석을 통해 개선사항 도출/개선 추진 - 사업장 내 사고예방 활동 기획 및 추진 필수사항 - 안전/환경/화학공학 등...
https://kr.indeed.com/viewjobs?jk=090e71cf6a5f6ccf,[웹젠] 국내마케팅(신입/경력),웹젠 성남 분당구,,"접수기간 2021.03.11(목) 10:00 ~ 2021.03.31(수) 23:59 D-16 • 담당업무 - 마케팅 광고, 프로모션 기획/실행 - 마케팅 전략 수립 및 단계별 Action Plan 기획/실행 - 각종..."
https://kr.indeed.com/viewjobs?jk=56bf5590ec791cb7,광고 수익화 담당자 [인턴],쿡앱스 성남 분당구,,광고 수익화 담당자 [인턴] Purple Cow 스튜디오 소개 “주목할 만한 가치가 있고 Remarkable 한 게임을 제작하는 스튜디오” 쿡앱스 퍼플카우 스튜디오는 유저에게 평생 기억에 남을 좋은 게임을 만들기 위해 높은...
https://kr.indeed.com/viewjobs?jk=ce22acf73c4a88a5,"Admin, Import/Export 1",KLA-Tencor 대한민국,,"back into R&D. Our expert teams of physicists, engineers, data scientists and problem-solvers work together... world..."
https://kr.indeed.com/viewjobs?jk=e393fa440b668be7,Data Analyst,Toss 서울 강남구,,"커뮤니케이션: Product, Data Platform, Developer... 모델링 관련 석/박사 학위 소지하신 분 혹은 경험이 풍부하신 분 - Data Warehouse 구축 지식이나 경험이 있으신 분 - Python, R..."
https://kr.indeed.com/viewjobs?jk=df933efadceefa55,Retail Operations - Intern,Mercedes-Benz Korea Limited 4.0 서울,,"Experiencing the data analysis approach by supporting the data verification work... report with recent data (TA, Projection..."
https://kr.indeed.com/viewjobs?jk=d25c92a2b84a10d3,[L'Oreal Korea] E-Retail Team Manger,L'Oreal 4.1 서울,,"calendar, product exclusivities, cross-selling mechanisms, data ownership within eCommerce brands websites and e-retailers..."
https://kr.indeed.com/viewjobs?jk=e9410a4de3827931,Data Input Assoc,IQVIA 서울,,data into IQVIA systems. Essential Functions • Develops an understanding... technical knowledge needed to code data...
https://kr.indeed.com/viewjobs?jk=3136b2f52a5fe976,인재 Pool 등록,S&I Corp. 대한민국,,수행 계획 수립 및 BIM Data 관리 (일정/품질 등) - BIM 기획... 계획 수립 및 BIM Data 관리 (일정/품질 등) - Project BIM 운영/관리 - 수행 계획 수립 및 BIM Data 관리 (일정/품질 등...
