ID,Title,Location,Salary,Summary
https://kr.indeed.com/viewjobs?jk=5fabc892216e1c62,[Business Insights] Business Data Analys...,PUBG 서울,,"data warehouse and work with other data... workflow design, and data cleansing • Work across multiple data sources (Web..."
https://kr.indeed.com/viewjobs?jk=0b8541aed6590a79,"[국비지원 전액무료/120명]AI(인공지능),BC(블록체인) 교육생",고려대학교 세종캠퍼스 세종특별자치시 세종,,"100% 국비지원 전액무료, 인공지능(AI), 블록체인(BC) 2021년 충청권 인공지능, 블록체인 교육 프로그램 교육생 모집 회사소개 사업목적 충청권 디지털 경제 전환을 가속화하고 전산업 AI 융합확산을 위해 주요 지역에..."
https://kr.indeed.com/viewjobs?jk=39bd7c1537b927ce,IT AI IoT 전자제품 브랜드 마케팅 디지털 마컴 부장,피플투피플 성남 중원구,,"【채용포지션】 IT AI IoT 전자제품 브랜드 마케팅 디지털 마컴 부장 【채용회사】 코스닥등록 정보통신업체 【근무지】 경기 성남시 【채용직급】 부장 【담당업무】 1) 브랜드 마케팅 전략 기획, 실행 - B2B2C 브랜드 전략..."
https://kr.indeed.com/viewjobs?jk=700e3b12ea55f7e4,AWS Next Gen Intern 2021 (July - January...,Amazon Web Services Korea LLC 서울,,capability to provide data-driven... use Excel or other software to provide data to support analyses • Excellent English...
https://kr.indeed.com/viewjobs?jk=f7d53450f2918067,[교원그룹] 라이프사업본부 신입/경력 수시,교원그룹 서울 중구,,[라이프사업본부] 신입/경력직 수시채용 (상품 기획 및 운영 / CRM마케팅) 03.03(수) - 03.21(일) 모집부문 및 직무소개 직무/모집인원 경력 직무소개 상품 기획 및 운영 신입 (서울 근무) 1. 직무소개 - 상조...
https://kr.indeed.com/viewjobs?jk=a746de9c7a6168ef,Healthcare Real World Data Analyst 담당자,IQVIA 서울,,leading human data science company... Job Description HIRA / Claims data 를 기반으로 data analysis 진행 Outcome Research 관련 업무...
https://kr.indeed.com/viewjobs?jk=82f2299bf5fbee17,2021년도 제직원(정규직),녹색기술센터 서울,,"채용분야 연구 고용형태 정규직 대체인력여부 아니오 학력정보 박사 채용구분 신입+경력 근무지 서울 채용인원 3 우대조건 국가보훈대상자, 장애인, 여성과학기술인 공고기간 21.03.09 ~ 21.03.24 응시자격 <공통응시자격..."
https://kr.indeed.com/viewjobs?jk=1d06836ff2ad75e9,21년 클라우드부문 경력사원,롯데정보통신 서울,,"응시자격 해외 여행 및 건강상 결격 사유가 없는 분 남성의 경우, 군필 혹은 면제자 외 국가유공자 국가보훈대상자 및 장애인은 관련 법규에 의거 우대함 4년제 학사 학위 보유 필수 모집부문 세부 모집요강 참조 BigData..."
https://kr.indeed.com/viewjobs?jk=7b04030358d701b1,[서울시뉴딜] 디지털사이니지 · 실감콘텐츠 분야 전문인력 양성 교육 /...,스마트미디어산업진흥협회 서울,,비대면/언택트 산업 활성화 전문인력 취업연계 과정 교육 모집 교육목표 비대면 서비스의 핵심인프라인 디지털사이닞(D.S)와 실감콘텐츠 및 콘텐츠 관리를 위한 전문인력의 역량강화를 위한 직무교육을 실시하고 교육 수료 후 관련...
https://kr.indeed.com/viewjobs?jk=8b963b47ec66525d,법인영업/영업기획 매니저,쏘카 대한민국,,법인영업/영업기획 매니저 경력조건 무관 쏘카 비즈니스팀 소개 • 쏘카 비즈니스팀은 카셰어링을 기반으로 기업들에게 새로운 업무 이동 방식을 제안합니다. • 기업들의 업무 이동 패턴 및 차량 운영 현황을 분석하여 고객에게 더...
https://kr.indeed.com/viewjobs?jk=7c0673b6736726d3,"[창업비0원, 300만원 혜택] 동해/삼척/태백 스마트올클래스(구 공부방...",웅진씽크빅 동해삼척지국 강원도,"월급 3,000,000원","유치원/학습지교사 방문 학습지 1명... 신입/경력 학력무관 무관 무관 http://image.alba.kr/data_image/j_photo/2019/10/14/11.png"" 2021년 03월 15일(월..."
https://kr.indeed.com/viewjobs?jk=c0a4fda2d7f271eb,Intelligence All-Source Analyst – Korean...,CAE Inc. 경기도 평택,,project data used to draw conclusions and estimates probabilities based on historical and current collection data. Translate...
https://kr.indeed.com/viewjobs?jk=2b09f13b5790dd69,2021년 한화시스템 방산부문 프로젝트/기간제 엔지니어 채용(상시),한화그룹 4.2 서울,,"레이다-체계A 계약기간 : 입사 시 ~ 2026.12.31(변동가능) [직무 내용] 레이다 체계 종합 [자격 요건] 전공 : 전자/제어/컴퓨터공학 학사 이상 경력 - 전기, 전자 및 컴퓨터 전공자 - 매트랩 사용..."
https://kr.indeed.com/viewjobs?jk=9f4a404b406dd19e,[KSTEC] 2021년 경력 사원 (SW개발자),지식시스템 성남 분당구,,지식시스템(주) KSTEC Inc. 2021년 신입 및 경력사원 채용 (SW개발자) KSTEC 과 함께 성장해 나갈 분야별 전문가를 모집합니다. KSTEC은 1998년 창립 이래 끊임없는 기술 내재화를 통해 「스마트 ICT...
https://kr.indeed.com/viewjobs?jk=5015781911d160c4,한화생명 플랫폼개발팀 개발자 경력채용,한화그룹 4.2 서울,,Front-End 개발자 직무소개 / About The Job : 이 직무는 한화생명에서 개발 중인 서비스의 프론트엔드 개발 및 개선 업무를 담당합니다. 책임 / Responsibilities • 한화생명 서비스를 위한...
https://kr.indeed.com/viewjobs?jk=8ff8b73dd0acd844,사업본부 인턴,사단법인한국기업지배구조원 서울 영등포구,"월급 1,830,000원","- 관련 분야 학사 학위 소지자 또는 학사과정 수료자(졸업예정), 휴학생 지원 가능 - 전공무관 (예체능 계열 제외) ※우대사항 : 데이터 수집을 위한 컴퓨터 활용능력 우수자 (엑셀, 파이썬 등) 한국기업지배구조원 사업본부 인턴..."
https://kr.indeed.com/viewjobs?jk=00202773c73843a7,Administrative Support Assistant (CYS) (...,US Department of the Army 4.3 대한민국,,CYMS) to record transactions for customers... enter data into predefined categories for reports and tracking. Provides...
https://kr.indeed.com/viewjobs?jk=b836cc551f8d1692,[EY컨설팅] 컨설팅본부 Data & Analytics팀 인턴 모집,EY 4.0 대한민국,,지고 탁월한 고객 서비스를 제공하고 있습니다. [EY컨설팅] 컨설팅본부 Data & Analytics팀 인턴 모집 * 모집 분야 - 분석 컨설팅... 파일명과 메일 제목은 반드시 [ Data & Analytics _인턴_성명...
https://kr.indeed.com/viewjobs?jk=f65f6085d70b75ed,앱 서비스 기획자 경력사원,LG전자 3.8 서울특별시,,"1. 필요 Skill 및 직무 경험 - 앱 서비스 기획, UX 기획 7년 이상 - 데이터 기반 서비스 발굴 기회 발굴 경험 - 서비스 로드맵 기획 경험 - 기획 프로세스 전반의 오퍼레이션 이해 및 운영경험 - 개발, 디자이너..."
https://kr.indeed.com/viewjobs?jk=3d2dc163b813197a,대기업 크레인 / 호이스트 설계 (계약직),제이엔커리어 성남 분당구,,Hoist 구매 사양서 작성 및 Technical Evaluation 작업 - 타 분야(기계/건축) 간 설계 Data 협의 및 설계 기술협의 [자격요건] - Crane & Hoist 부문 설계 3년 이상 유경험자 (제작업체...
https://kr.indeed.com/viewjobs?jk=51b5799b18b34f57,[EY한영] 전략·재무자문본부 운영혁신전략팀 Value Creation...,Ernst & Young 4.0 대한민국,,"Transformation & Big Data Analytics: DT를 활용한 New Biz. Opportunity 발굴 및 Operation 최적화 전략 수립 (AI, Robotics/RPA, Data Analytics..."
https://kr.indeed.com/viewjobs?jk=883ec65275936707,[HR] HR Generalist (경력),네이버 서울,,주니어포지션) ㅇ 인사담당자로써 원활한 협업 및 커뮤니케이션이 가능한 자 ㅇ 영어 커뮤니케이션 가능자 ㅇ DATA 분석 및 Report 작성 능력 보유자 • 우대사항 ㅇ 국내/글로벌 IT기업에서 채용 업무 경험자 ㅇ 채용전략...
https://kr.indeed.com/viewjobs?jk=6e8677c7d80e2d4c,"Technical Solutions Engineer, Big Data,...",Google 4.3 서울,,"distributed data processing frameworks... data analytics, warehousing, ETL development, data science or other Big Data..."
https://kr.indeed.com/viewjobs?jk=d5fb8006ecbcddc9,[INFRA] 2021년 상반기 경리/사무/해피콜/인바운드 상담원 등 /...,휴인(HUUIN) 서울 동대문구,,[INFRA] 2021년 상반기 경리/사무입력/해피콜/영업직 모집 모집부문 및 자격요건 담당업무 자격요건 인원 1>경리업무 2>사무입력 업무(데이터관리) 3>해피콜 업무 4>영업직 인바운드 상담업무 [자격요건] 경력사항: 신입...
https://kr.indeed.com/viewjobs?jk=977a7a5a265a0e89,GAP Scheduler Planner,"Atlas Copco Korea Co., Ltd. 부산광역시",,maintain schedule data to ensure project... raise red flag • Maintain master data... SAP Project/Network/WBS standards...
https://kr.indeed.com/viewjobs?jk=a4219749e86c817e,지식재산권 관련 온라인서비스 웹기획 (경력),윕스 서울 마포구,,모집부문 - 모집 부서: 온라인기획팀 - 해당 직군: 서비스 기획 - 해당 직무: 지식재산권 관련 온라인 서비스 웹기획 - 고용 형태: 정규직 ※ 담당 업무 - 지식재산 관련 데이터 활용서비스 웹기획 - 윕스...
https://kr.indeed.com/viewjobs?jk=2fdc753b8607542b,[인프라] 데이터베이스 관리자 (MySQL),한국카카오은행 성남 분당구,,담당할 업무 [MySQL]· MySQL 데이터베이스 운영 및 자동화· MySQL HA/DR 구성 테스트 및 표준화· MySQL 백업/복구 자동화· MySQL Performance Tuning· MySQL 모니터링 및 분석...
https://kr.indeed.com/viewjobs?jk=196ce1e719186cc2,씨티에스보안(주) 영업 마케팅 및 영업관리,씨티에스보안 서울,,[영업관리·영업지원... 활용 능력자 우대 - 커뮤니케이션 스킬이 뛰어난 자 - 분석적 사고 및 정확한 업무처리 능력 보유자 [일반·법인영업] - 적극적이고 밝은 성격의 용모 단정한자 - 서비스 마인드 보유자 [기술영업...
https://kr.indeed.com/viewjobs?jk=49c87a68f29bf347,SH공사 전문가,서울특별시 5.0 대한민국,,법무·도시설계·공공디벨로퍼·리츠·재무·에너지·홍보전략·설계VE·공유재산관리 SH공사 전문가 채용공고 서울의 주거복지와 도시공간을 창조하는 SH공사에서 전문적인 지식과 풍부한 경험을 가진 전문가를 모집합니다. 1. 모집분...
https://kr.indeed.com/viewjobs?jk=80604aae91fb4274,National Position: Administrative Associ...,UNFPA 서울,,"Competencies: Providing logistical support; Managing Data; Managing documents, correspondence and reports; Managing..."
https://kr.indeed.com/viewjobs?jk=cf3612c7353b1423,[전문연구요원] Data Science – Data Analytics,엔씨소프트 2.7 성남 판교역,,사이트를 방문해 주시기 바랍니다. - 회사 공식 블로그: https://blog.ncsoft.com/rd/ data-science - I&I실 기술 블로그: https://danbi-ncsoft.github.io - 외부...
